{
  "schema_version": "sp500_risk_snapshot_v1",
  "api_version": "1.0.0",
  "snapshot_type": "latest",
  "market": {
    "name": "S&P 500",
    "symbol": "SPX"
  },
  "model": {
    "model_id": "sp500_risk_monitor_v2_final",
    "model_version": "v2_final",
    "parameter_status": "frozen",
    "freeze_date": "2026-09-24",
    "higher_score_means": "higher_risk",
    "internal_score_range": {
      "minimum": 30.0,
      "maximum": 85.0
    },
    "display_score_range": {
      "minimum": 0.0,
      "maximum": 100.0
    },
    "missing_data_policy": "no_imputation; partial coverage is provisional"
  },
  "timestamps": {
    "as_of_date": "2026-09-24",
    "generated_at": "2026-09-24 07:23:26",
    "refresh_completed_at": "2026-09-24T07:23:25+00:00"
  },
  "operational_state": "DEGRADED",
  "overall": {
    "internal_score": 45.211151,
    "display_score": 24.122844,
    "model_coverage": 1.0,
    "status": "complete",
    "score_type": "official",
    "risk_level_code": "L2",
    "risk_description": "Low Risk",
    "provisional_internal_score": 45.211151,
    "provisional_display_score": 24.122844,
    "official_internal_score": 45.211151,
    "official_display_score": 24.122844
  },
  "pillars": {
    "monetary": {
      "internal_score": 49.988095,
      "display_score": 35.761762,
      "score_type": "official",
      "status": "complete",
      "coverage": 1.0,
      "indicator_coverage": 1.0,
      "category_weight": 25.0,
      "configured_indicator_count": 4,
      "scored_indicator_count": 4,
      "total_indicator_weight": 100.0,
      "scored_weight": 100.0,
      "available_internal_score": 49.988095,
      "available_display_score": 35.761762,
      "model_internal_score": 49.988095,
      "model_display_score": 35.761762
    },
    "credit": {
      "internal_score": 34.991429,
      "display_score": 0.0,
      "score_type": "official",
      "status": "complete",
      "coverage": 1.0,
      "indicator_coverage": 1.0,
      "category_weight": 25.0,
      "configured_indicator_count": 4,
      "scored_indicator_count": 4,
      "total_indicator_weight": 100.0,
      "scored_weight": 100.0,
      "available_internal_score": 34.991429,
      "available_display_score": 0.0,
      "model_internal_score": 34.991429,
      "model_display_score": 0.0
    },
    "sentiment": {
      "internal_score": 43.392857,
      "display_score": 19.692612,
      "score_type": "official",
      "status": "complete",
      "coverage": 1.0,
      "indicator_coverage": 1.0,
      "category_weight": 25.0,
      "configured_indicator_count": 4,
      "scored_indicator_count": 4,
      "total_indicator_weight": 100.0,
      "scored_weight": 100.0,
      "available_internal_score": 43.392857,
      "available_display_score": 19.692612,
      "model_internal_score": 43.392857,
      "model_display_score": 19.692612
    },
    "trend": {
      "internal_score": 52.472222,
      "display_score": 41.814281,
      "score_type": "official",
      "status": "complete",
      "coverage": 1.0,
      "indicator_coverage": 1.0,
      "category_weight": 25.0,
      "configured_indicator_count": 3,
      "scored_indicator_count": 3,
      "total_indicator_weight": 75.0,
      "scored_weight": 75.0,
      "available_internal_score": 52.472222,
      "available_display_score": 41.814281,
      "model_internal_score": 52.472222,
      "model_display_score": 41.814281
    }
  },
  "indicators": [
    {
      "id": "fed_funds_rate",
      "category": "monetary",
      "name": "Federal Funds Rate",
      "configured_source": "FRED",
      "ticker": "FEDFUNDS",
      "configured_provider": "OpenBB",
      "weight": 25.0,
      "effective_weight_share_in_pillar": 0.25,
      "frequency": "monthly",
      "scoring_method": "change",
      "lookback_months": 12,
      "source_last_date": "2026-08-01",
      "as_of_date": "2026-09-24",
      "raw_value": 3.63,
      "metric_value": -0.59,
      "risk_band": "low",
      "score": 30.0,
      "scoring_status": "scored",
      "health": {
        "health_status": "ok",
        "age_calendar_days": 54,
        "freshness_allowance_days": 62,
        "stale": false,
        "provider_warning": false,
        "refresh_status": "live",
        "refresh_provider": "FRED",
        "cache_used": false,
        "warning": null
      }
    },
    {
      "id": "yield_curve",
      "category": "monetary",
      "name": "10Y-2Y Treasury Spread",
      "configured_source": "FRED",
      "ticker": "T10Y2Y",
      "configured_provider": "OpenBB",
      "weight": 25.0,
      "effective_weight_share_in_pillar": 0.25,
      "frequency": "daily",
      "scoring_method": "percentile",
      "lookback_months": 120,
      "source_last_date": "2026-09-23",
      "as_of_date": "2026-09-24",
      "raw_value": 0.26,
      "metric_value": 41.666667,
      "risk_band": "medium",
      "score": 65.952381,
      "scoring_status": "scored",
      "health": {
        "health_status": "ok",
        "age_calendar_days": 1,
        "freshness_allowance_days": 7,
        "stale": false,
        "provider_warning": false,
        "refresh_status": "live",
        "refresh_provider": "FRED",
        "cache_used": false,
        "warning": null
      }
    },
    {
      "id": "financial_conditions",
      "category": "monetary",
      "name": "Chicago Fed National Financial Conditions Index",
      "configured_source": "FRED",
      "ticker": "NFCI",
      "configured_provider": "OpenBB",
      "weight": 30.0,
      "effective_weight_share_in_pillar": 0.3,
      "frequency": "weekly",
      "scoring_method": "zscore",
      "lookback_months": 120,
      "source_last_date": "2026-09-18",
      "as_of_date": "2026-09-24",
      "raw_value": -0.555,
      "metric_value": -0.606042,
      "risk_band": "low",
      "score": 30.0,
      "scoring_status": "scored",
      "health": {
        "health_status": "ok",
        "age_calendar_days": 6,
        "freshness_allowance_days": 14,
        "stale": false,
        "provider_warning": false,
        "refresh_status": "live",
        "refresh_provider": "FRED",
        "cache_used": false,
        "warning": null
      }
    },
    {
      "id": "real_yield",
      "category": "monetary",
      "name": "10-Year Treasury Inflation Indexed Yield",
      "configured_source": "FRED",
      "ticker": "DFII10",
      "configured_provider": "OpenBB",
      "weight": 20.0,
      "effective_weight_share_in_pillar": 0.2,
      "frequency": "daily",
      "scoring_method": "percentile",
      "lookback_months": 120,
      "source_last_date": "2026-09-22",
      "as_of_date": "2026-09-24",
      "raw_value": 2.63,
      "metric_value": 100.0,
      "risk_band": "high",
      "score": 85.0,
      "scoring_status": "scored",
      "health": {
        "health_status": "ok",
        "age_calendar_days": 2,
        "freshness_allowance_days": 7,
        "stale": false,
        "provider_warning": false,
        "refresh_status": "live",
        "refresh_provider": "FRED",
        "cache_used": false,
        "warning": null
      }
    },
    {
      "id": "high_yield_spread",
      "category": "credit",
      "name": "ICE BofA High Yield Option-Adjusted Spread",
      "configured_source": "FRED",
      "ticker": "BAMLH0A0HYM2",
      "configured_provider": "OpenBB",
      "weight": 40.0,
      "effective_weight_share_in_pillar": 0.4,
      "frequency": "daily",
      "scoring_method": "zscore",
      "lookback_months": 120,
      "source_last_date": "2026-09-22",
      "as_of_date": "2026-09-24",
      "raw_value": 2.68,
      "metric_value": -1.222485,
      "risk_band": "low",
      "score": 30.0,
      "scoring_status": "scored",
      "health": {
        "health_status": "ok",
        "age_calendar_days": 2,
        "freshness_allowance_days": 7,
        "stale": false,
        "provider_warning": false,
        "refresh_status": "live",
        "refresh_provider": "FRED",
        "cache_used": false,
        "warning": null
      }
    },
    {
      "id": "investment_grade_spread",
      "category": "credit",
      "name": "ICE BofA US Corporate Investment Grade Spread",
      "configured_source": "FRED",
      "ticker": "BAMLC0A0CM",
      "configured_provider": "OpenBB",
      "weight": 20.0,
      "effective_weight_share_in_pillar": 0.2,
      "frequency": "daily",
      "scoring_method": "zscore",
      "lookback_months": 120,
      "source_last_date": "2026-09-22",
      "as_of_date": "2026-09-24",
      "raw_value": 0.77,
      "metric_value": -1.221426,
      "risk_band": "low",
      "score": 30.0,
      "scoring_status": "scored",
      "health": {
        "health_status": "ok",
        "age_calendar_days": 2,
        "freshness_allowance_days": 7,
        "stale": false,
        "provider_warning": false,
        "refresh_status": "live",
        "refresh_provider": "FRED",
        "cache_used": false,
        "warning": null
      }
    },
    {
      "id": "corporate_default_rate",
      "category": "credit",
      "name": "Business Loan Delinquency Rate",
      "configured_source": "FRED",
      "ticker": "DRBLACBS",
      "configured_provider": "OpenBB",
      "weight": 20.0,
      "effective_weight_share_in_pillar": 0.2,
      "frequency": "quarterly",
      "scoring_method": "change",
      "lookback_months": 12,
      "source_last_date": "2026-04-01",
      "as_of_date": "2026-09-24",
      "raw_value": 1.27,
      "metric_value": -0.02,
      "risk_band": "low",
      "score": 34.6,
      "scoring_status": "scored",
      "health": {
        "health_status": "ok",
        "age_calendar_days": 176,
        "freshness_allowance_days": 254,
        "stale": false,
        "provider_warning": false,
        "refresh_status": "live",
        "refresh_provider": "FRED",
        "cache_used": false,
        "warning": null
      }
    },
    {
      "id": "bank_lending_conditions",
      "category": "credit",
      "name": "Senior Loan Officer Survey Tightening",